{
  "$schema": "https://json-schema.org/draft/2020-12/schema",
  "$id": "https://popeye.twg.internal/schemas/session-credential-issuance-request/0.1",
  "title": "Popeye session credential issuance request",
  "description": "Structural schema for the request in fiskroad/contracts/NONO_POPEYE_SESSION_CREDENTIAL_CONTRACT_v0.1.md section 2.1. It is a pre-review validation artifact, not an issuance implementation.",
  "type": "object",
  "required": [
    "principal_type",
    "agent_id",
    "on_behalf_of",
    "purpose",
    "tenant_id",
    "requested_ttl_seconds",
    "session_id",
    "device_ref"
  ],
  "additionalProperties": false,
  "properties": {
    "principal_type": {
      "const": "agent"
    },
    "agent_id": {
      "type": "string",
      "minLength": 1
    },
    "on_behalf_of": {
      "type": "string",
      "minLength": 1,
      "$comment": "Whether this identifier resolves to an agent is an issuer-side identity lookup, not a request-shape assertion."
    },
    "purpose": {
      "type": "string",
      "enum": [
        "servicing",
        "origination",
        "collections",
        "analytics",
        "marketing",
        "compliance-review",
        "internal-support"
      ]
    },
    "tenant_id": {
      "type": "string",
      "pattern": "^[0-9a-f]{8}-[0-9a-f]{4}-[0-9a-f]{4}-[0-9a-f]{4}-[0-9a-f]{12}$"
    },
    "requested_ttl_seconds": {
      "type": "integer",
      "$comment": "The issuer clamps an integer to its configured maximum. A maximum is intentionally not encoded here."
    },
    "session_id": {
      "type": "string",
      "format": "uuid"
    },
    "device_ref": {
      "type": "string",
      "minLength": 1,
      "$comment": "Opaque request field; its identity semantics remain subject to D-1."
    }
  },
  "$comment": "Caller authorization is outside this body and remains subject to D-1."
}
